[
  {
    "format": "airalogy.record",
    "schema_version": 1,
    "record_id": "33333333-3333-4333-8333-333333333333",
    "record_version": 1,
    "metadata": {
      "protocol_id": "contact_note",
      "protocol_version": "0.1.0",
      "created_at": "2026-06-08T08:20:00Z",
      "source": "examples/aira"
    },
    "data": {
      "var": {
        "person_name": "Katherine Johnson",
        "channel": "chat",
        "summary": "Flagged a question that should become a task."
      },
      "step": {},
      "check": {},
      "quiz": {}
    }
  },
  {
    "format": "airalogy.record",
    "schema_version": 1,
    "record_id": "44444444-4444-4444-8444-444444444444",
    "record_version": 1,
    "metadata": {
      "protocol_id": "measurement_note",
      "protocol_version": "0.1.0",
      "created_at": "2026-06-08T08:30:00Z",
      "source": "examples/aira"
    },
    "data": {
      "var": {
        "sample_name": "sample-a",
        "measurement_value": 37.2,
        "measurement_unit": "C",
        "operator": "Airalogy Example"
      },
      "step": {},
      "check": {},
      "quiz": {}
    }
  }
]
